index,name,line
322,Beth,"Hey guys, we're home."
323,Morty &amp; Summer,"Mom, Dad!"
324,Jerry,"Um, hold the phone, where did you guys get those necklaces from? Uh, Lady Gaga, table for three, am I right?"
325,Beth,*laughs*
326,Jerry,"Are you guys Power Rangers? But only on one small part of your necks? Hey, do those things need batteries? Were they included? Clean up in the fruit isle! Not in a homophobic way though, they're just fruity necklaces is all I was saying."
327,Beth, *laughing* I'm gonna pee my pants.
328,Morty,"Doesn't feel so good, does it?"
329,Rick,No it doesn't. It hurts.
330,Beth,I'm gonna pee-hee-hee.
331,Jerry,"Somebody call the planet of Tron, we have three Tron people over here. But seriously, are these Halloween costumes? Are you going as motorcycles? With green headlights instead of normal ones? Are you dogs? Robot dogs? Gosh, you guys are lame. Are those chokers from the 90's? What is this, a 90's nostalgia thing? Are you guys in that movie “The Craft” with Fairuza Balk?"
332,Testicle Monster A,"Hey man, when the hell were you?"
333,Testicle Monster B,"Looking for you, asshole."
334,Testicle Monster A,I told you past the dinosaurs.
335,Testicle Monster B,You know how much time is past the dinosaurs? Half of all time!
336,Testicle Monster A,"Come on, man, it's this way..."
337,Testicle Monster B,"Come on, give me that thing, speed it up, he can't be this far back."
338,Testicle Monster A,"There he is, there he is, there he is, there he is, stop, stop."
339,Testicle Monster B,"So that's the guy, huh?"
340,Testicle Monster A,"Yeah, that's him. Hey, man, remember me? [he and Monster B start beating up Einstein, knocking him to the ground] I got something for your ass! You don't mess with time! You don't fuck with time, motherfucker! [he and Monster B leave]"
341,Albert Einstein,I vill mess vith time!
342,Albert Einstein,I vill mess vith time...
